{
  "schema_version": "1.0",
  "release_id": "helix-evidence-v1",
  "release_status": "PUBLIC_RELEASE",
  "publication_approved": true,
  "reproduction_level": "RECEIPT_VERIFICATION",
  "claims": [
    {
      "claim_id": "ER-03",
      "release_status": "PUBLIC_RELEASE",
      "publication_approved": true,
      "authority_status": "ACCEPTED_WITH_REQUIRED_QUALIFIERS",
      "exact_permitted_statement": "In the frozen 1,027,744-row Kraken historian fixture with 10 deterministic synthetic tail-appended rows, FULL processed 1,027,744 workload-defined rolling-row transforms and Helix processed 173; the benchmark recorded identical complete canonical output under its equivalence gate and SHA-256 digest.",
      "evidence_class": "MEASURED",
      "frozen_verdict": "PASS",
      "conditions": [
        "One retained-state historian fixture with a deterministic ten-row tail append.",
        "One affected feature partition containing 173 rows.",
        "The compared counter is defined by the workload, not by CPU instructions or total operations."
      ],
      "measurement": {
        "metric": "workload-defined rolling-row transforms",
        "unit": "one rolling transform per historian row",
        "recorded_values": {
          "full": 1027744,
          "helix": 173,
          "full_div_helix": "5940.7167630057803468208092485549132947976878612717",
          "reduction_percent": "99.983167014353769031976834698134944110595634710589"
        }
      },
      "accounting_boundary": {
        "included": [
          "FULL rolling transforms over every target historian row",
          "Helix rolling transforms over the affected 173-row feature partition"
        ],
        "excluded": [
          "dataset loading and upstream preparation",
          "change-obligation resolution and retained-state maintenance",
          "validation, serialization, persistence, network, and elapsed time"
        ],
        "unknown": [
          "total CPU work",
          "end-to-end latency",
          "production economics"
        ]
      },
      "exactness_scope": "The frozen benchmark recorded a passing equivalence gate and matching SHA-256 digests for the FULL and Helix complete canonical outputs. The complete million-row outputs are not published for independent re-hashing.",
      "limitations": [
        "The counts are rolling-row transforms, not total work.",
        "FULL applied the same Python rolling operator across the target state; it was not an independently optimized historian or database comparator.",
        "The counter was derived from workload adapter coverage, not independent instrumentation of total CPU, I/O, or end-to-end work.",
        "The exactness routes shared the workload operator and were not checked against an external semantic oracle.",
        "The result is specific to the frozen tail-append fixture.",
        "The execution worktree was dirty and content binding was partial: 28/28 enumerated files matched, but one dirty imported file and the interpreter or third-party binaries were not contemporaneously content-bound.",
        "Receipt verification does not rerun the workload."
      ],
      "reproduction_level": "RECEIPT_VERIFICATION",
      "receipt_path": "releases/v1/receipts/ER-03-kraken-transform-count",
      "forbidden_inferences": [
        "Helix was 5,941 times faster.",
        "Helix avoided 99.983% of CPU, I/O, memory, cost, or total work.",
        "The result is independently publicly reproducible."
      ]
    },
    {
      "claim_id": "ER-04",
      "release_status": "PUBLIC_RELEASE",
      "publication_approved": true,
      "authority_status": "PUBLIC_BOUNDED_PASS",
      "exact_permitted_statement": "Across three frozen 40-transition sparse/local campaigns, compressed expanded FULL used between 4.364290× and 4.475920× the application-payload bytes used by Helix under the N=5 snapshot policy, and between 7.594434× and 7.939030× under N=10. Across both policies, all 240 Helix transitions and all 120 expanded-FULL transitions reconstructed the expected state exactly.",
      "evidence_class": "MEASURED",
      "frozen_verdict": "PASS",
      "conditions": [
        "Three independently seeded deterministic generated 40-transition histories using native Delta Change Data Feed.",
        "Compressed application artifacts were delivered over localhost TCP to a separate receiver.",
        "Periodic complete snapshots every five or ten transitions were included in the corresponding Helix totals."
      ],
      "measurement": {
        "metric": "expanded FULL application-payload bytes divided by Helix application-payload bytes",
        "unit": "ratio of bytes delivered through the application socket",
        "recorded_values": {
          "n5_minimum": "4.364290",
          "n5_maximum": "4.475920",
          "n10_minimum": "7.594434",
          "n10_maximum": "7.939030",
          "campaigns": 3,
          "helix_transitions_exact": 240,
          "expanded_full_transitions_exact": 120
        }
      },
      "accounting_boundary": {
        "included": [
          "compressed application-payload bytes delivered over localhost TCP",
          "all periodic snapshot traffic for the N=5 and N=10 policies"
        ],
        "excluded": [
          "common initial snapshot",
          "TCP/IP framing and physical network counters",
          "cloud egress, pricing, storage economics, and latency"
        ],
        "unknown": [
          "public-internet behavior",
          "production network overhead"
        ]
      },
      "exactness_scope": "Receiver state was compared with the expected source state after every accepted transition: 240/240 Helix transitions and 120/120 expanded-FULL transitions were exact in the frozen campaigns.",
      "limitations": [
        "The upper ratio is one measured campaign-policy cell, not an average or universal expectation.",
        "The result is bounded to the tested workload, encoding, and snapshot policy.",
        "In a separately tested dense condition, FULL was the smaller exact representation; no universal crossover threshold is claimed."
      ],
      "reproduction_level": "RECEIPT_VERIFICATION",
      "receipt_path": "releases/v1/receipts/ER-04-transport",
      "forbidden_inferences": [
        "Helix reduced physical wire bytes by 7.939×.",
        "Helix reduced cloud egress cost by 7.939×.",
        "Helix is universally 7.939× smaller."
      ]
    },
    {
      "claim_id": "ER-05",
      "release_status": "PUBLIC_RELEASE",
      "publication_approved": true,
      "authority_status": "PUBLIC_BOUNDED_PASS",
      "exact_permitted_statement": "Across three frozen 40-transition sparse/local historical-storage campaigns, compressed expanded FULL history used between 4.028407489997796× and 4.120914703075985× the retained file bytes used by Helix under the N=5 snapshot policy, and between 6.527574829433984× and 6.774059647451816× under N=10. Across all tested representations and policies, all 135 requested reconstructions were exact.",
      "evidence_class": "MEASURED",
      "frozen_verdict": "PASS",
      "conditions": [
        "Three independently seeded deterministic generated histories using native Delta Change Data Feed.",
        "Forty transitions per history.",
        "Reconstructable history with complete snapshots every five and ten transitions."
      ],
      "measurement": {
        "metric": "expanded FULL retained file bytes divided by Helix retained file bytes",
        "unit": "ratio of flushed retained file lengths",
        "recorded_values": {
          "n5_minimum": "4.028407489997796",
          "n5_maximum": "4.120914703075985",
          "n10_minimum": "6.527574829433984",
          "n10_maximum": "6.774059647451816",
          "exact_reconstructions": 135,
          "attempted_reconstructions": 135,
          "helix_exact_reconstructions": 54,
          "helix_attempted_reconstructions": 54
        }
      },
      "accounting_boundary": {
        "included": [
          "retained artifact file lengths",
          "required metadata",
          "periodic snapshots and reconstruction artifacts"
        ],
        "excluded": [
          "filesystem allocation and journal traffic",
          "device write amplification",
          "cloud storage pricing"
        ],
        "unknown": [
          "other filesystems and downstream compression stacks",
          "production lifecycle costs"
        ]
      },
      "exactness_scope": "All 135 scheduled historical reconstructions across the tested representations matched their expected state; the Helix-specific subset was 54/54.",
      "limitations": [
        "The comparator is expanded history, not one latest snapshot or the smallest incremental encoding.",
        "A tested competent incremental comparator retained fewer application-file bytes than Helix, but the formats did not carry identical authority semantics.",
        "The result applies when reconstructable prior generations are required.",
        "The result does not claim an advantage after every downstream deduplication or compression stack."
      ],
      "reproduction_level": "RECEIPT_VERIFICATION",
      "receipt_path": "releases/v1/receipts/ER-05-historical-storage",
      "forbidden_inferences": [
        "Helix is universal compression.",
        "Helix always minimizes historical bytes.",
        "Helix reduced physical storage writes by 6.774×."
      ]
    },
    {
      "claim_id": "ER-06",
      "release_status": "PUBLIC_RELEASE",
      "publication_approved": true,
      "authority_status": "PUBLIC_BOUNDED_PASS",